id,naslov,avtor,rating,num_rating,num_review,ganres,pages,vezava,leto
2051,The Simple Art of Murder,Raymond Chandler,4.13,6099,278,"Mystery,Fiction,Short Stories,Crime,Noir,Detective,Hard Boiled",384,Paperback,1944
2052,The Big Sleep,Raymond Chandler,3.95,157750,8095,"Mystery,Fiction,Classics,Crime,Noir,Detective,Mystery Thriller",231,Paperback,1939
2053,"The Big Sleep / Farewell, My Lovely / The High Window",Raymond Chandler,4.48,1436,35,"Fiction,Mystery,Classics,Noir,Crime,Horror,Novels",696,Hardcover,1942
2054,The Long Goodbye,Raymond Chandler,4.19,43231,2863,"Mystery,Fiction,Crime,Noir,Classics,Detective,Mystery Thriller",379,Paperback,1953
2055,Long Goodbye: The Deaths of Nancy Cruzan,William H. Colby,4.18,85,13,"Nonfiction,Memoir",416,Paperback,2002
2056,An Evening of Long Goodbyes,Paul Murray,3.64,1783,196,"Fiction,Humor,Ireland,Irish Literature,Novels,Literary Fiction,Contemporary",448,Paperback,2003
2057,The Long Goodbye,Patti   Davis,3.86,344,46,"Biography,Memoir,Nonfiction,Presidents,History,Biography Memoir,Politics",224,Paperback,2005
2058,Ghost In the Shell 2: Innocence: After the Long Goodbye,Masaki Yamada,4.00,319,18,"Manga,Science Fiction,Fiction,Cyberpunk,Japanese Literature,Novels,Graphic Novels",196,Hardcover,2004
2060,Mandie and the Long Goodbye,Lois Gladys Leppard,3.95,621,10,"Mystery,Historical Fiction,Christian,Fiction,Childrens,Christian Fiction,Young Adult",156,Mass Market Paperback,1998
2061,The Long Italian Goodbye,Robert Benedetti,4.00,4,0,"Book details & editions,",245,Hardcover,2005
2062,A Long Goodbye and Beyond: Coping With Alzheimer's,Linda Combs,4.00,6,1,"Book details & editions,",160,Paperback,1994
2066,"The Yankee Doodler: Music, Theater and Fun in the American Revolution",Sylvia G.L. Dannett,0.00,0,0,"Book details & editions,",319,Hardcover,1974
2067,Breaking the Spell: Religion as a Natural Phenomenon,Daniel C. Dennett,3.89,12605,543,"Philosophy,Nonfiction,Science,Atheism,Psychology,Evolution,Sociology",464,Hardcover,2006
2068,Darwin's Dangerous Idea: Evolution and the Meanings of Life,Daniel C. Dennett,4.07,16534,357,"Science,Philosophy,Nonfiction,Evolution,Biology,History,Psychology",588,Paperback,1995
2069,Consciousness Explained,Daniel C. Dennett,3.90,8304,442,"Philosophy,Science,Psychology,Nonfiction,Neuroscience,Biology,Brain",511,Paperback,1991
2070,Sweet Dreams: Philosophical Obstacles to a Science of Consciousness,Daniel C. Dennett,3.74,455,35,"Philosophy,Science,Nonfiction,Psychology,Neuroscience,Brain",216,Paperback,2005
2071,Freedom Evolves,Daniel C. Dennett,3.82,2814,134,"Philosophy,Nonfiction,Science,Evolution,Psychology,Biology,Neuroscience",368,Paperback,2003
2072,Brainstorms: Philosophical Essays on Mind and Psychology,Daniel C. Dennett,3.96,639,17,"Philosophy,Psychology,Nonfiction,Science,Essays,Neuroscience,Artificial Intelligence",377,Paperback,1978
2073,The Intentional Stance,Daniel C. Dennett,4.00,324,16,"Philosophy,Psychology,Nonfiction,Science,Research,Neuroscience,Artificial Intelligence",388,Paperback,1987
2074,Kinds of Minds: Toward an Understanding of Consciousness,Daniel C. Dennett,3.82,2081,110,"Philosophy,Science,Psychology,Nonfiction,Neuroscience,Biology,Evolution",184,Paperback,1996
2075,Thy Will Be Done: The Conquest of the Amazon: Nelson Rockefeller and Evangelism in the Age of Oil,Gerard Colby,4.44,81,13,"History,Politics,Nonfiction,Economics,American History,Religion,Social Justice",1008,Paperback,1995
2076,Kinds of Minds: The Origins of Consciousness,Daniel C. Dennett,3.82,2081,110,"Philosophy,Science,Psychology,Nonfiction,Neuroscience,Biology,Evolution",192,Paperback,1996
2077,"Leaps of Faith: Science, Miracles, and the Search for Supernatural Consolation",Nicholas Humphrey,3.81,36,4,"Philosophy,Nonfiction,Skepticism,Science",256,Paperback,1995
2078,Elbow Room: The Varieties of Free Will Worth Wanting,Daniel C. Dennett,3.90,767,67,"Philosophy,Nonfiction,Science,Psychology,Metaphysics,Neuroscience,Atheism",248,Paperback,1984
2079,UFOs Over California: A True History of Extraterrestrial Encounters in the Golden State,Preston Dennett,4.14,22,3,Mystery,192,Paperback,2004
2080,UFOs Over Topanga Canyon,Preston Dennett,4.20,20,5,Mystery,312,Paperback,1999
2081,The Mind’s I: Fantasies and Reflections on Self and Soul,Douglas R. Hofstadter,4.15,5864,156,"Philosophy,Nonfiction,Science,Psychology,Neuroscience,Essays,Artificial Intelligence",512,Paperback,1981
2082,The Dennett Quartet,Daniel C. Dennett,3.33,3,1,Philosophy,1356,Paperback,1998
2083,Out-of-Body Exploring: A Beginner's Approach,Preston Dennett,3.81,26,2,"Book details & editions,",200,Paperback,2004
2084,"Workers, Neighbors, and Citizens: The Revolution in Mexico City",John Lear,4.00,10,1,History,441,Paperback,2001
2085,John Lear,Michel Deutsch,0.00,0,0,"Book details & editions,",90,Paperback,1996
2086,The Nonsense Verse of Edward Lear,Edward Lear,3.92,36,6,Poetry,256,Paperback,2012
2087,Recombinant DNA: The Untold Story,John Lear,4.00,2,0,"Book details & editions,",280,Hardcover,1978
2088,"Kepler's Dream: With the Full Text and Notes of Somnium, Sive Astronomia Lunaris, Joannis Kepleri",Johannes Kepler,3.50,355,66,"Science Fiction,Fiction,Classics,Astronomy,Fantasy,Philosophy,Physics",192,Hardcover,1634
2089,The Powerlifter's Manual,John Lear,0.00,0,0,"Book details & editions,",64,Paperback,1982
2090,Weight Lifting,John Lear,4.00,1,0,"Book details & editions,",40,Paperback,1980
2091,Freud,Jonathan Lear,4.06,354,45,"Psychology,Philosophy,Psychoanalysis,Nonfiction,Biography,Academic,Book Club",296,Paperback,2005
2092,"Happiness, Death, and the Remainder of Life",Jonathan Lear,3.87,78,8,"Philosophy,Psychoanalysis,Nonfiction",189,Hardcover,2000
2093,The Illustrated A Brief History of Time,Stephen Hawking,4.21,439781,12806,"Science,Nonfiction,Physics,History,Classics,Astronomy,Philosophy",248,Hardcover,1988
2094,A Briefer History of Time,Stephen Hawking,4.26,40060,1661,"Science,Nonfiction,Physics,History,Astronomy,Popular Science,Philosophy",176,Hardcover,2005
2095,The Universe in a Nutshell,Stephen Hawking,4.18,43096,1288,"Science,Nonfiction,Physics,Astronomy,Popular Science,Space,Audiobook",216,Hardcover,2001
2096,God Created the Integers: The Mathematical Breakthroughs That Changed History,Stephen Hawking,4.07,1979,75,"Science,Mathematics,Nonfiction,History,Physics,Philosophy,Reference",1176,Hardcover,2005
2097,The Illustrated On the Shoulders of Giants: The Great Works of Physics and Astronomy,Stephen Hawking,4.21,5101,79,"Science,Physics,Nonfiction,Astronomy,History,Reference,Popular Science",256,Hardcover,2002
2098,Introducing Stephen Hawking,J.P.  McEvoy,3.84,712,59,"Science,Nonfiction,Biography,Physics,Graphic Novels,Comics,Popular Science",176,Paperback,1991
2099,Stephen Hawking's Universe: The Cosmos Explained,David Filkin,4.32,2015,28,"Science,Nonfiction,Physics,Astronomy,Space,Education,History",304,Paperback,1997
2100,The Future of Spacetime,Stephen Hawking,3.96,428,24,"Science,Physics,Nonfiction,Astronomy,Philosophy,Essays,Futurism",222,Paperback,2002
2101,"Galileo, Darwin, and Hawking: The Interplay of Science, Reason, and Religion",Phil Dowe,3.75,16,2,"Book details & editions,",213,Paperback,2005
2102,Stephen Hawking's Universe,John Boslough,4.03,799,41,"Science,Nonfiction,Physics,Biography,Astronomy,Reference,Popular Science",160,Mass Market Paperback,1984
2103,The Nature of Space and Time,Stephen Hawking,4.08,1399,78,"Science,Physics,Nonfiction,Philosophy,Popular Science,Astronomy,Reference",142,Paperback,1996
2104,The Physics of Star Trek,Lawrence M. Krauss,3.85,6025,303,"Science,Nonfiction,Star Trek,Physics,Popular Science,Reference,Space",188,Paperback,1995
2105,"God, Time, & Stephen Hawking: An Exploration into Origins",David  Wilkinson,3.85,20,4,"Philosophy,Physics,Science",224,Paperback,2001
2106,What's Out There: Images from Here to the Edge of the Universe,Mary K. Baumann,4.42,67,5,"Science,Astronomy,Nonfiction,Art,Space,Physics,Photography",244,Hardcover,2005
2107,Falconry & Hawking,Phillip Glasier,4.33,87,8,"Nonfiction,Nature",352,Hardcover,1978
2108,"The Modern Falconer: Training, Hawking & Breeding",Diana Durman-Walters,2.75,4,0,"Book details & editions,",176,Hardcover,1994
2109,"The World Treasury of Physics, Astronomy",Timothy Ferris,4.14,491,28,"Science,Physics,Nonfiction,Mathematics,Astronomy,Reference,Philosophy",880,Paperback,1991
2110,Stephen Hawking: A Life in Science,Michael White,3.79,608,55,"Science,Biography,Nonfiction,Physics,History,Astronomy,History Of Science",300,Paperback,1992
2111,The Theory of Everything: The Origin and Fate of the Universe,Stephen Hawking,4.18,25449,1835,"Science,Nonfiction,Physics,Astronomy,Audiobook,Philosophy,Space",136,Hardcover,2002
2112,The Art of Nonfiction: A Guide for Writers and Readers,Ayn Rand,3.97,515,57,"Writing,Nonfiction,Philosophy,Reference,Criticism,Education,Literary Fiction",208,Paperback,2001
2113,Journals of Ayn Rand,Ayn Rand,3.96,348,18,"Philosophy,Nonfiction,Biography,Autobiography,History,Psychology,American",752,Paperback,1997
2116,Essays on Ayn Rand's The Fountainhead,Robert Mayhew,4.15,74,2,"Philosophy,Criticism,Nonfiction",364,Paperback,2006
2117,Rand's The Fountainhead,CliffsNotes,3.83,52,4,"Philosophy,Fiction,Reference",144,Paperback,2000
2118,"The Fountainheads: Wright, Rand, the FBI and Hollywood",Donald Leslie Johnson,3.80,5,0,"Book details & editions,",243,Hardcover,2005
2119,The Fountainhead of Chinese Erotica: The Lord of Perfect Satisfaction (Ruyijun zhuan),Charles R. Stone,4.00,8,2,"Erotica,China",271,Hardcover,2003
2120,From the Fountainhead to the Future and Other Essays on Art and Excellence,Alexandra  York,3.14,7,0,"Book details & editions,",192,Paperback,2000
2121,The Fountainhead: An American Novel,Douglas J. Den Uyl,4.00,4,0,"Book details & editions,",144,Hardcover,1999
2123,"The 36-Hour Day: A Family Guide to Caring for Persons with Alzheimer Disease, Related Dementing Illnesses, and Memory Loss in Later Life",Nancy L. Mace,4.28,4164,522,"Nonfiction,Health,Self Help,Reference,Medical,Psychology,Medicine",624,Paperback,1981
2124,The 3-Hour Diet: How Low-Carb Diets Make You Fat and Timing Makes You Thin,Jorge Cruise,3.35,175,20,"Nonfiction,Health,Diets,Self Help",368,Hardcover,2005
2126,The 3-Hour Diet: On the Go,Jorge Cruise,3.12,43,3,"Book details & editions,",192,Paperback,2005
2127,The Last Hours of Ancient Sunlight: The Fate of the World and What We Can Do Before It's Too Late,Thom Hartmann,4.22,1857,177,"Nonfiction,Science,Environment,Spirituality,Philosophy,History,Climate Change",448,Paperback,1998
2128,The Divine Hours: Prayers for Autumn and Wintertime,Phyllis Tickle,4.41,679,38,"Prayer,Spirituality,Religion,Faith,Nonfiction,Christianity,Christian",688,Paperback,2000
2130,Twenty-Four Hours A Day,Anonymous,4.57,296,11,Self Help,400,Paperback,1992
2131,The Hours,Michael Cunningham,3.95,142920,6688,"Fiction,Historical Fiction,Contemporary,Literary Fiction,LGBT,Classics,Novels",230,Paperback,1998
2132,Michael Cunningham's The Hours: A Reader's Guide,Tory Young,3.96,28,2,"Book details & editions,",96,Paperback,2003
2133,Bookclub-in-a-box Discusses Michael Cunningham's Novel the Hours,Bookclub-in-a-Box,3.50,2,0,"Book details & editions,",80,Paperback,2005
2135,Les heures,Michael Cunningham,3.95,142920,6688,"Fiction,Historical Fiction,Contemporary,Literary Fiction,LGBT,Classics,Novels",247,Mass Market Paperback,1998
2136,Specimen Days,Michael Cunningham,3.61,6250,684,"Fiction,Science Fiction,Short Stories,Historical Fiction,American,Literature,Novels",336,Paperback,2005
2137,A Home at the End of the World,Michael Cunningham,3.93,20420,1198,"Fiction,LGBT,Queer,Contemporary,Gay,Romance,Novels",342,Paperback,1990
2138,Laws for Creations,Walt Whitman,4.00,48,8,"Poetry,Classics",208,Paperback,2006
2139,Flesh and Blood,Michael Cunningham,4.05,6147,495,"Fiction,LGBT,Contemporary,Gay,Family,Literature,Literary Fiction",465,Paperback,1995
2140,Blink: The Power of Thinking Without Thinking,Malcolm Gladwell,3.96,597805,18860,"Nonfiction,Psychology,Business,Self Help,Science,Sociology,Audiobook",277,Hardcover,2005
2141,In the Blink of an Eye: A Perspective on Film Editing,Walter Murch,4.22,7450,523,"Film,Nonfiction,Art,Media Tie In,Writing,Reference,Collections",146,Paperback,1995
2142,Blink,Ted Dekker,4.14,17844,894,"Christian Fiction,Fiction,Christian,Thriller,Fantasy,Suspense,Mystery",389,Paperback,2002
2144,Blink-182: Tales from Beneath Your Mom,Blink-182,4.37,229,30,"Nonfiction,Music,Biography",112,Paperback,2001
2146,Blink.,Phaidon Press,4.05,20,2,"Photography,Art",440,Paperback,2004
2148,"Blink, Blink, Clop, Clop: Why Do We Do Things We Can't Stop? An OCD Storybook",E. Katia Moritz,3.00,1,0,"Book details & editions,",61,Paperback,1998
2149,In the Blink of an Eye: How Vision Sparked the Big Bang of Evolution,Andrew Parker,4.01,253,32,"Science,Biology,Nonfiction,Evolution,History,Palaeontology,Earth Sciences",336,Paperback,2003
2151,The Complete Novels,Jane Austen,4.57,33456,751,"Classics,Fiction,Romance,Historical Fiction,Literature,Historical,Classic Literature",1136,Leather Bound,1981
2152,The Jane Austen Book Club,Karen Joy Fowler,3.10,70226,5063,"Fiction,Chick Lit,Romance,Contemporary,Books About Books,Adult Fiction,Adult",288,Paperback,2004
2154,The Oxford Illustrated Jane Austen,Jane Austen,4.60,2518,154,"Classics,Fiction,Romance,Historical Fiction,Literature,Historical,Classic Literature",2832,Hardcover,1950
2155,Jane Austen's Letters,Jane Austen,4.13,3059,193,"Nonfiction,Classics,Biography,History,Literature,Memoir,19th Century",643,Paperback,1908
2156,Persuasion,Jane Austen,4.15,714602,34251,"Fiction,Classics,Historical Fiction,Historical,Literature,Audiobook,19th Century",249,Paperback,1817
2157,Tea with Jane Austen,Kim   Wilson,3.80,1656,152,"Nonfiction,Cookbooks,History,Food,Tea,Cooking,British Literature",128,Hardcover,2004
2158,So You Think You Know Jane Austen?,John Sutherland,3.72,194,17,"Nonfiction,Literature,Books About Books,Literary Criticism,History,British Literature",240,Paperback,2005
2159,Confessions of an Economic Hit Man,John Perkins,3.87,37667,3935,"Nonfiction,Economics,Politics,History,Biography,Business,Memoir",303,Paperback,2004
2162,Confesiones de un gángster económico,John Perkins,3.87,37667,3935,"Nonfiction,Economics,Politics,History,Biography,Business,Memoir",352,Paperback,2004
2163,"The Hit Man: One Man's Strategy for Growth, Change, and Profit",Phillip W. Hurst,3.00,1,0,"Book details & editions,",192,Hardcover,2003
2164,"The Hit Man's Dilemma: Or, Business, Personal and Impersonal",Keith Hart,3.50,14,0,Economics,128,Paperback,2005
2165,The Old Man and the Sea,Ernest Hemingway,3.80,1176135,41351,"Classics,Fiction,Literature,Novels,School,American,Adventure",96,Hardcover,1952
2167,Hemingway's The Old Man and the Sea,CliffsNotes,2.78,9,0,"Book details & editions,",72,Paperback,2000
2170,The Old Man and the Sea - LitPlan Teacher Pack: A Complete Teacher's Manual,Mary B. Collins,2.00,1,0,"Book details & editions,",106,CD-ROM,1996
2171,My Old Man and the Sea: A Father and Son Sail Around Cape Horn,David Hays,3.88,810,93,"Nonfiction,Travel,Memoir,Adventure,Biography Memoir,Autobiography,Outdoors",227,Paperback,1968
2174,Flaubert: A Biography,Frederick Brown,3.94,51,16,"Biography,History,Nonfiction,Biography Memoir,France",640,Hardcover,2006
2175,Madame Bovary,Gustave Flaubert,3.70,340832,16935,"Fiction,Classics,France,Literature,French Literature,Romance,19th Century",329,Paperback,1856
2176,Flaubert's Parrot,Julian Barnes,3.65,15603,1405,"Fiction,Literature,Literary Fiction,British Literature,Novels,Contemporary,Historical Fiction",190,Paperback,1984
2177,The Letters of Gustave Flaubert: 1857-1880,Gustave Flaubert,4.55,62,4,"France,Nonfiction,Autobiography,Biography",309,Hardcover,1982
2178,Flaubert in Egypt,Gustave Flaubert,3.61,477,50,"Travel,Nonfiction,Classics,Egypt,France,19th Century,History",230,Paperback,1849
2179,A Sentimental Education,Gustave Flaubert,3.81,22707,1266,"Classics,Fiction,France,French Literature,19th Century,Literature,Novels",464,Paperback,1869
2181,The George Sand-Gustave Flaubert Letters,George Sand,4.15,368,50,"Nonfiction,Biography,France,French Literature,Memoir,Classics,History",240,Paperback,1921
2182,Three Tales,Gustave Flaubert,3.63,7088,517,"Fiction,Short Stories,Classics,France,French Literature,Literature,19th Century",144,Paperback,1877
2183,Sentimental Education,Gustave Flaubert,3.81,22707,1266,"Classics,Fiction,France,French Literature,19th Century,Literature,Novels",460,Paperback,1869
2185,The Dictionary of Accepted Ideas,Gustave Flaubert,3.78,1342,142,"Nonfiction,France,Classics,French Literature,Humor,Literature,Philosophy",92,Paperback,1913
2186,The Family Idiot: Gustave Flaubert 1821-1857 - Volume 5,Jean-Paul Sartre,4.13,8,1,"Biography,Nonfiction",632,cloth,1977
2187,Middlesex,Jeffrey Eugenides,4.03,643750,26587,"Fiction,Historical Fiction,Contemporary,LGBT,Classics,Literary Fiction,Queer",529,Paperback,2002
2189,"Sex in Middlesex: Popular Mores in a Massachusetts County, 1649-1699",Roger Thompson,3.37,19,5,History,272,Paperback,1986
2190,"A Place in Time: Middlesex County, Virginia, 1650-1750",Darrett B. Rutman,3.65,20,2,History,292,Paperback,1984
2191,"Street Atlas: Middlesex County, Massachusetts",Arrow Map Inc,0.00,0,0,"Book details & editions,",80,Paperback,1998
2192,A Mouth Like Yours,Daniel Duane,2.67,27,6,"Book details & editions,",208,Hardcover,2005
2193,Surfers,Daniel Duane,1.00,1,0,"Book details & editions,",144,Paperback,1997
2194,Lighting Out: A Vision of California and the Mountains,Daniel Duane,3.84,75,10,"Climbing,Nature",292,Paperback,1994
2195,Looking for Mo,Daniel Duane,3.66,73,10,"Book details & editions,",240,Paperback,1998
2196,El Capitan: Historic Feats and Radical Routes,Daniel Duane,3.89,36,3,"Climbing,Travel",144,Hardcover,2000
2197,Enoch and Daniel: A Form Critical and Sociological Study of the Historical Apocalypses,Stephen Breck Reid,0.00,0,0,"Book details & editions,",162,Paperback,2004
2198,Maverick's: The Story of Big-Wave Surfing,Matt Warshaw,4.17,65,4,"Nonfiction,Sports",224,Hardcover,2000
2199,Team of Rivals: The Political Genius of Abraham Lincoln,Doris Kearns Goodwin,4.28,188582,8399,"History,Nonfiction,Biography,Politics,American History,Civil War,Presidents",916,Paperback,2005
2203,John Adams,David McCullough,4.08,363884,7291,"History,Biography,Nonfiction,American History,Presidents,Politics,Historical",751,Paperback,2001
2204,The John Adams Reader: Essential Writings on an American Composer,Thomas May,3.63,27,5,"Music,Essays",455,Hardcover,2006
2205,The Letters of John and Abigail Adams,John  Adams,4.15,360,36,"History,Nonfiction,Biography,American History,Classics,Politics,Memoir",512,Paperback,1840
2206,The Adams-Jefferson Letters: The Complete Correspondence Between Thomas Jefferson & Abigail & John Adams,Lester Jesse Cappon,4.28,1214,48,"History,Nonfiction,American History,Biography,Presidents,Politics,American Revolution",688,Paperback,1959
2207,John Adams: A Life,John Ferling,4.17,2190,71,"Biography,History,Presidents,American History,Nonfiction,Us Presidents,Politics",535,Hardcover,1992
2208,John Adams & the Spirit of Liberty,C. Bradley Thompson,4.49,37,3,"Nonfiction,History,American History,Politics,Philosophy",360,Unknown Binding,1998
2209,Passionate Sage: The Character and Legacy of John Adams,Joseph J. Ellis,4.07,3059,126,"History,Biography,Nonfiction,American History,Presidents,American Revolution,Politics",277,Paperback,1993
2210,The Revolutionary John Adams,Cheryl Harness,4.09,110,30,"History,Biography,Nonfiction,American Revolution,American History,Picture Books,Childrens",48,Paperback,2003
2211,The Portable John Adams,John  Adams,4.09,67,3,"History,Politics,American History,Nonfiction,Biography,Classics,Essays",533,Paperback,2004
2212,The Bible Lessons of John Quincy Adams for His Son,Douglas W. Phillips,3.76,29,5,"History,Christian Living,Biography,Christian",91,Paperback,2000
2213,Relationships For Dummies,Kate M. Wachs,3.53,55,2,"Self Help,Relationships,Psychology",416,Paperback,2002
2214,Dating For Dummies,Joy Browne,3.14,140,14,"Nonfiction,Self Help,Relationships,Reference,Personal Development,Psychology",432,Paperback,1997
2215,Raising Smart Kids For Dummies,Marlene Targ Brill,3.36,14,1,"Book details & editions,",368,Paperback,2003
2216,Family Reunion Planning Kit for Dummies,Cheryl Fall,4.33,3,0,"Book details & editions,",324,Paperback,2001
2217,Romance for Dummies,Ruth Westheimer,3.00,7,1,"Book details & editions,",128,Hardcover,2001
2218,Sex for Dummies,Ruth Westheimer,3.73,400,51,"Sexuality,Nonfiction,Reference,Psychology,Adult,Counselling,Self Help",432,Paperback,2000
2219,Baby Signing for Dummies,Jennifer Watson,3.78,88,10,"Parenting,Linguistics,Nonfiction",284,Paperback,2006
2220,Chronic Pain for Dummies,Stuart S. Kassan,3.74,27,3,Nonfiction,384,Paperback,2006
2221,Your Baby's First Year For Dummies,James Gaylord,3.78,154,14,"Parenting,Nonfiction,Childrens",384,Paperback,2005
2222,The Feeling Good Handbook,David D. Burns,3.95,6604,181,"Self Help,Psychology,Nonfiction,Mental Health,Health,Personal Development,Reference",729,Paperback,1989
2223,Growing Up Feeling Good: The Life Handbook for Kids,Ellen Rosenberg,4.25,8,2,"Psychology,Parenting",544,Paperback,1983
2224,"Personal Fitness: Looking Good, Feeling Good",Charles S. Williams,3.89,19,0,"Book details & editions,",122,Paperback,1992
2225,Moods and Emotions: A Handbook About Feelings,Ruth Shannon Odor,0.00,0,0,"Book details & editions,",112,Library Binding,1980
2226,On Death and Dying,Elisabeth Kübler-Ross,4.16,26775,775,"Psychology,Nonfiction,Death,Philosophy,Self Help,Medicine,Spirituality",288,Hardcover,1969
2227,Questions & Answers on Death and Dying,Elisabeth Kübler-Ross,4.10,274,14,"Nonfiction,Psychology,Death,Self Help,Spirituality,Health,Philosophy",192,Paperback,1974
2228,The Last Dance: Encountering Death and Dying,Lynne Ann DeSpelder,3.86,349,38,"Nonfiction,Psychology,Death,Sociology,Textbooks,Read For School,Academic",696,Hardcover,2004
2229,"Ethnic Variations in Dying, Death and, Grief: Diversity in Universality",Donald P. Irish,3.81,26,1,"Death,Psychology",248,Paperback,1993
2230,Insights on Death & Dying,Joy Ufema,3.25,4,1,"Book details & editions,",278,Paperback,2006
2231,The Kid's Book About Death and Dying,Eric Rofes,5.00,5,1,"Book details & editions,",119,Hardcover,1985
2232,"Grief, Dying, and Death: Clinical Interventions for Caregivers",Therese A. Rando,4.12,42,2,"Counselling,Nonfiction,Psychology",494,Paperback,1984
2233,Blessing the Bridge: What Animals Teach Us About Death and Dying,Rita M. Reynolds,4.32,69,13,"Nonfiction,Animals",174,Paperback,2000
2234,Living with Death and Dying,Elisabeth Kübler-Ross,4.07,216,13,"Nonfiction,Psychology,Death,Self Help,Medical",192,Paperback,1982
2235,"Death & Dying, Life & Living",Charles A. Corr,3.86,78,6,"School,Nonfiction,Psychology,Textbooks",677,Paperback,1993
2236,Mahatma Gandhi and His Myths,Mark Shepard,3.64,353,32,"Nonfiction,History,Biography,Politics",46,Paperback,1989
2237,Radiology for Anaesthesia & Intensive Care,Richard Hopkins,5.00,1,0,"Book details & editions,",352,Paperback,2002
2238,The Gandhi Quartet,Chaman Nahal,2.75,4,0,"Book details & editions,",1856,Hardcover,1993
2240,Tai chi chuan: Aplicaciones marciales:  Estilo Yang Avanzado,Yang Jwing-Ming,5.00,1,0,"Book details & editions,",414,Paperback,2001
2242,The Way of All the Earth,John S. Dunne,4.00,23,0,Philosophy,233,Paperback,1972
2243,Finding Your Self in India,Diana Iles,0.00,0,0,"Book details & editions,",320,Paperback,2001
2245,The Human Rights Committee and the Right of Individual Communication: Law and Practice,P.R. Ghandhi,3.00,1,0,"Book details & editions,",522,Hardcover,1998
2246,Solid-Liquid Flow Slurry Pipeline Transportation,Edward J. Wasp,4.60,5,0,"Book details & editions,",224,Hardcover,1977
2248,"Knit India Through Literature, Volume II: The East",Sivasankari,5.00,3,0,"Book details & editions,",391,Hardcover,2000
2249,The 7 Habits of Highly Effective People: Powerful Lessons in Personal Change,Stephen R. Covey,4.16,754942,15114,"Self Help,Nonfiction,Business,Personal Development,Psychology,Leadership,Productivity",358,Paperback,1994
2250,The 7 Habits of Highly Effective People: Personal Workbook,Stephen R. Covey,4.25,3902,222,"Self Help,Nonfiction,Business,Personal Development,Leadership,Productivity,Psychology",192,Paperback,2003
2253,Daily Reflections for Highly Effective People: Living the 7 Habits of Highly Successful People Every Day,Stephen R. Covey,3.92,415,32,"Nonfiction,Self Help,Business,Personal Development,Leadership,Inspirational,Philosophy",368,Paperback,1994
2254,The 7 Habits of Highly Effective People,Stephen R. Covey,4.16,754942,15114,"Self Help,Nonfiction,Business,Personal Development,Psychology,Leadership,Productivity",340,Paperback,1994
2255,Way of the Peaceful Warrior: A Book That Changes Lives,Dan Millman,4.13,53963,2516,"Spirituality,Fiction,Philosophy,Self Help,Personal Development,Psychology,Inspirational",217,Paperback,1980
2256,Sacred Journey of the Peaceful Warrior,Dan Millman,4.14,9829,215,"Spirituality,Fiction,Self Help,Philosophy,Inspirational,New Age,Personal Development",249,Paperback,1991
2257,Secret of the Peaceful Warrior,Dan Millman,4.19,176,17,"Childrens,Picture Books,Spirituality",32,Hardcover,1991
2258,Way of the Peaceful Warrior and Sacred Journey of the Peaceful Warrior,Dan Millman,4.13,53963,2516,"Spirituality,Fiction,Philosophy,Self Help,Personal Development,Psychology,Inspirational",227,Hardcover,1980
2259,The Peaceful Warrior Collection,Dan Millman,4.45,597,29,"Spirituality,Philosophy,Personal Development,Self Help,Nonfiction",437,Hardcover,2000
2260,Wisdom of the Peaceful Warrior: A Companion to the Book that Changes Lives,Dan Millman,4.16,517,31,"Spirituality,Philosophy,Nonfiction,Self Help,Personal Development,New Age",224,Paperback,2006
2261,Grand Valley Dani: Peaceful Warriors,Karl G. Heider,3.33,49,5,"Anthropology,Nonfiction,Ethnography",208,Paperback,1990
